<?xml version="1.0" encoding="UTF-8"?>
<sdf3 type="sadf" version="1.0" xmlns:xsi="http://www.w3.org/2001/XMLSchema-instance" xmlns="uri:sadf" xsi:schemaLocation="uri:sadf http://www.es.ele.tue.nl/sadf/sdf3-sadf.xsd">
<sadf name="mp3_worst_case_sdf">

<structure>
  <kernel name="Huffman"/>
  <kernel name="RequantizationLeft"/>
  <kernel name="RequantizationRight"/>
  <kernel name="ReorderLeft"/>
  <kernel name="ReorderRight"/>
  <kernel name="Stereo"/>
  <kernel name="AliasReductionLeft"/>
  <kernel name="AliasReductionRight"/>
  <kernel name="IMDCTLeft"/>
  <kernel name="IMDCTRight"/>
  <kernel name="FrequencyInversionLeft"/>
  <kernel name="FrequencyInversionRight"/>
  <kernel name="SynthesisLeft"/>
  <kernel name="SynthesisRight"/>
  <kernel name="Write"/>
  
  <channel name="H2RQL" source="Huffman" destination="RequantizationLeft" type="data"/>
  <channel name="H2RQR" source="Huffman" destination="RequantizationRight" type="data"/>
  <channel name="RQL2S" source="RequantizationLeft" destination="Stereo" type="data"/>
  <channel name="RQL2ROL" source="RequantizationLeft" destination="ReorderLeft" type="data"/>
  <channel name="RQR2S" source="RequantizationRight" destination="Stereo" type="data"/>
  <channel name="RQR2ROR" source="RequantizationRight" destination="ReorderRight" type="data"/>
  <channel name="ROL2S" source="ReorderLeft" destination="Stereo" type="data"/>
  <channel name="ROR2S" source="ReorderRight" destination="Stereo" type="data"/>
  <channel name="S2ARL" source="Stereo" destination="AliasReductionLeft" type="data"/>
  <channel name="S2IMDCTL" source="Stereo" destination="IMDCTLeft" type="data"/>
  <channel name="S2ARR" source="Stereo" destination="AliasReductionRight" type="data"/>
  <channel name="S2IMDCTR" source="Stereo" destination="IMDCTRight" type="data"/>
  <channel name="ARL2IMDCTL" source="AliasReductionLeft" destination="IMDCTLeft" type="data"/>
  <channel name="ARR2IMDCTR" source="AliasReductionRight" destination="IMDCTRight" type="data"/>
  <channel name="IMDCTL2FIL" source="IMDCTLeft" destination="FrequencyInversionLeft" type="data"/>
  <channel name="IMDCTR2FIR" source="IMDCTRight" destination="FrequencyInversionRight" type="data"/>
  <channel name="FIL2SL" source="FrequencyInversionLeft" destination="SynthesisLeft" type="data"/>
  <channel name="FIR2SR" source="FrequencyInversionRight" destination="SynthesisRight" type="data"/>
  <channel name="SL2W" source="SynthesisLeft" destination="Write" type="data"/>
  <channel name="SR2W" source="SynthesisRight" destination="Write" type="data"/>
  <channel name="W2H" source="Write" destination="Huffman" type="data"/>
</structure>

<properties>
  <kernel_properties kernel="Huffman">
    <scenario name="Default">
      <consume channel="W2H" tokens="1"/>
      <produce channel="H2RQL" tokens="1152"/>
      <produce channel="H2RQR" tokens="1152"/>
      <profile execution_time="236070"/>
    </scenario>
  </kernel_properties>

  <kernel_properties kernel="RequantizationLeft">
    <scenario name="L+S">
      <consume channel="H2RQL" tokens="576"/>
      <produce channel="RQL2S" tokens="576"/>
      <produce channel="RQL2ROL" tokens="576"/>
      <profile execution_time="139325"/>
    </scenario>
  </kernel_properties>

  <kernel_properties kernel="RequantizationRight">
    <scenario name="L+S">
      <consume channel="H2RQR" tokens="576"/>
      <produce channel="RQR2S" tokens="576"/>
      <produce channel="RQR2ROR" tokens="576"/>
      <profile execution_time="139325"/>
    </scenario>
  </kernel_properties>

  <kernel_properties kernel="ReorderLeft">
    <scenario name="S">
      <consume channel="RQL2ROL" tokens="576"/>
      <produce channel="ROL2S" tokens="576"/>
      <profile execution_time="69385"/>
    </scenario>
  </kernel_properties>

  <kernel_properties kernel="ReorderRight">
    <scenario name="S">
      <consume channel="RQR2ROR" tokens="576"/>
      <produce channel="ROR2S" tokens="576"/>
      <profile execution_time="69385"/>
    </scenario>
  </kernel_properties>

  <kernel_properties kernel="Stereo">
    <scenario name="LL+SS">
      <consume channel="RQL2S" tokens="576"/>
      <consume channel="RQR2S" tokens="576"/>
      <produce channel="S2ARL" tokens="576"/>
      <produce channel="S2ARR" tokens="576"/>
      <consume channel="ROL2S" tokens="576"/>
      <consume channel="ROR2S" tokens="576"/>
      <produce channel="S2IMDCTL" tokens="576"/>
      <produce channel="S2IMDCTR" tokens="576"/>
      <profile execution_time="73618"/>
    </scenario>
  </kernel_properties>

  <kernel_properties kernel="AliasReductionLeft">
    <scenario name="BL">
      <consume channel="S2ARL" tokens="18"/>
      <produce channel="ARL2IMDCTL" tokens="18"/>
      <profile execution_time="409"/>
    </scenario>
  </kernel_properties>

  <kernel_properties kernel="AliasReductionRight">
    <scenario name="BL">
      <consume channel="S2ARR" tokens="18"/>
      <produce channel="ARR2IMDCTR" tokens="18"/>
      <profile execution_time="409"/>
    </scenario>
  </kernel_properties>

  <kernel_properties kernel="IMDCTLeft">
    <scenario name="BL+BS">
      <consume channel="ARL2IMDCTL" tokens="6"/>
      <consume channel="S2IMDCTL" tokens="6"/>
      <produce channel="IMDCTL2FIL" tokens="6"/>
      <profile execution_time="7414"/>
    </scenario>
  </kernel_properties>

  <kernel_properties kernel="IMDCTRight">
    <scenario name="BL+BS">
      <consume channel="ARR2IMDCTR" tokens="6"/>
      <consume channel="S2IMDCTR" tokens="6"/>
      <produce channel="IMDCTR2FIR" tokens="6"/>
      <profile execution_time="7414"/>
    </scenario>
  </kernel_properties>

  <kernel_properties kernel="FrequencyInversionLeft">
    <scenario name="BL">
      <consume channel="IMDCTL2FIL" tokens="6"/>
      <produce channel="FIL2SL" tokens="6"/>
      <profile execution_time="4912"/>
    </scenario>
  </kernel_properties>

  <kernel_properties kernel="FrequencyInversionRight">
    <scenario name="BL">
      <consume channel="IMDCTR2FIR" tokens="6"/>
      <produce channel="FIR2SR" tokens="6"/>
      <profile execution_time="4912"/>
    </scenario>
  </kernel_properties>

  <kernel_properties kernel="SynthesisLeft">
    <scenario name="default">
      <consume channel="FIL2SL" tokens="576"/>
      <produce channel="SL2W" tokens="576"/>
      <profile execution_time="1866138"/>
    </scenario>
  </kernel_properties>

  <kernel_properties kernel="SynthesisRight">
    <scenario name="default">
      <consume channel="FIR2SR" tokens="576"/>
      <produce channel="SR2W" tokens="576"/>
      <profile execution_time="1866138"/>
    </scenario>
  </kernel_properties>

  <kernel_properties kernel="Write">
    <scenario name="default">
      <consume channel="SL2W" tokens="1152"/>
      <consume channel="SR2W" tokens="1152"/>
      <produce channel="W2H" tokens="1"/>
      <profile execution_time="42896"/>
    </scenario>
  </kernel_properties>

  <channel_properties channel="W2H" number_of_initial_tokens="9"/>

</properties>

</sadf>
</sdf3>