<?xml version="1.0" encoding="UTF-8"?>
<sdf3 type="sadf" version="1.0" xmlns:xsi="http://www.w3.org/2001/XMLSchema-instance" xmlns="uri:sadf" xsi:schemaLocation="uri:sadf http://www.es.ele.tue.nl/sadf/sdf3-sadf.xsd">
<sadf name="sdf">

<structure>
  <kernel name="A"/>
  <kernel name="B"/>
  <kernel name="C"/>
  <channel name="A2B" source="A" destination="B" type="data"/>
  <channel name="B2C" source="B" destination="C" type="data"/>
  <channel name="C2A" source="C" destination="A" type="data"/>
</structure>

<properties>
  <kernel_properties kernel="A">
    <scenario name="default">
      <consume channel="C2A" tokens="1"/>
      <produce channel="A2B" tokens="1"/>
      <profile execution_time="1"/>
    </scenario>
  </kernel_properties>

  <kernel_properties kernel="B">
    <scenario name="default">
      <consume channel="A2B" tokens="50"/>
      <produce channel="B2C" tokens="2"/>
      <profile execution_time="1"/>
    </scenario>
  </kernel_properties>

  <kernel_properties kernel="C">
    <scenario name="default">
      <consume channel="B2C" tokens="1"/>
      <produce channel="C2A" tokens="25"/>
      <profile execution_time="1"/>
    </scenario>
  </kernel_properties>
  
  <channel_properties channel="B2C" number_of_initial_tokens="4"/>

</properties>

</sadf>
</sdf3>
